{
  "schema": "xebench-sessions-index",
  "schemaVersion": "1.1",
  "policy": "publication-policy-v1",
  "selectionRule": "engine-set-newest-verified-else-newest-unverified",
  "keys": [
    {
      "key": "llama.cpp|cpu|android|Google Fixture Phone|Llama 3.2 1B|Q4_K_M|measured",
      "displayed": "1767225600000-2-phone",
      "rule": "newest-unverified",
      "sessions": [
        {
          "sessionId": "1767225600000-2-phone",
          "timestampIso": "2026-01-01T00:00:00.000Z",
          "bundleSha256": "bb5dbeccbb9bb5b1305f6a6c84813ee043fcfdb530f9d1a889591ea7ba0719c6",
          "url": "https://raw.githubusercontent.com/a-ghorbani/xebench/main/evidence/bb5dbeccbb9bb5b1305f6a6c84813ee043fcfdb530f9d1a889591ea7ba0719c6/manifest.json",
          "validation": "unverified",
          "guardsPassed": null,
          "row": {
            "engine": "llama.cpp",
            "backend": "cpu",
            "platform": "android",
            "device": "Google Fixture Phone",
            "soc": "Tensor G4",
            "model": "Llama 3.2 1B",
            "quant": "Q4_K_M",
            "ppTps": 200.3,
            "tgTps": 30.1,
            "ttftMs": 25.5,
            "provenance": "measured",
            "sourceName": "PocketPal R&D lab (xebench)",
            "sourceUrl": "https://github.com/a-ghorbani/xebench/blob/main/METHODOLOGY.md",
            "sourceDate": "2026-01",
            "sampleCount": 1,
            "asStated": "n=1 cold-run median; prompt std-pp512-v1; decode 128 tok; publication-policy-v1 unverified: artifact unknown (the configured run pins no modelSha256)",
            "validation": "unverified",
            "guardsPassed": null,
            "conditionPolicy": "run-conditions-v2",
            "protocolVersion": "cpu-reference-v3",
            "configurationId": "cpu-reference-v2",
            "configurationSha256": "df5d28855b5c31ecb3de86539df7ffc0b35c7870c6ee6c7110afd35dc55294f7",
            "timingMethod": "engine-timings",
            "dispersion": {
              "ppTps": {
                "iqr": 0,
                "min": 200.3,
                "max": 200.3
              },
              "tgTps": {
                "iqr": 0,
                "min": 30.1,
                "max": 30.1
              }
            },
            "evidence": {
              "sessionIds": [
                "1767225600000-2-phone"
              ],
              "bundleSha256": "bb5dbeccbb9bb5b1305f6a6c84813ee043fcfdb530f9d1a889591ea7ba0719c6",
              "url": "https://raw.githubusercontent.com/a-ghorbani/xebench/main/evidence/bb5dbeccbb9bb5b1305f6a6c84813ee043fcfdb530f9d1a889591ea7ba0719c6/manifest.json"
            },
            "build": {
              "engineVersion": "llama.cpp b11385 (bf9a0cc)",
              "bindingVersion": "llama.rn 0.0.0-fixture",
              "harnessCommit": "0123456789abcdef0123456789abcdef01234567",
              "runtimes": [
                {
                  "name": "llama.cpp",
                  "version": "b11385"
                },
                {
                  "name": "llama.rn",
                  "version": "0.0.0-fixture"
                }
              ]
            }
          }
        }
      ],
      "replacedRows": []
    },
    {
      "key": "llama.cpp|cpu|android|Google Fixture Tablet|Llama 3.2 1B|Q4_K_M|measured",
      "displayed": null,
      "rule": "no-session-in-set",
      "sessions": [
        {
          "sessionId": "1767225600000-3-tablet",
          "timestampIso": "2026-01-01T00:00:00.000Z",
          "bundleSha256": "bb5dbeccbb9bb5b1305f6a6c84813ee043fcfdb530f9d1a889591ea7ba0719c6",
          "url": "https://raw.githubusercontent.com/a-ghorbani/xebench/main/evidence/bb5dbeccbb9bb5b1305f6a6c84813ee043fcfdb530f9d1a889591ea7ba0719c6/manifest.json",
          "validation": "failed",
          "guardsPassed": false,
          "row": {
            "engine": "llama.cpp",
            "backend": "cpu",
            "platform": "android",
            "device": "Google Fixture Tablet",
            "soc": "Tensor G4",
            "model": "Llama 3.2 1B",
            "quant": "Q4_K_M",
            "ppTps": 195.4,
            "tgTps": 30.8,
            "ttftMs": 26.3,
            "provenance": "measured",
            "sourceName": "PocketPal R&D lab (xebench)",
            "sourceUrl": "https://github.com/a-ghorbani/xebench/blob/main/METHODOLOGY.md",
            "sourceDate": "2026-01",
            "sampleCount": 2,
            "asStated": "n=2 cold-run median; prompt std-pp512-v1; decode 128 tok; publication-policy-v1 failed: conditions fail (session verdict fail; repetitions fail)",
            "validation": "failed",
            "guardsPassed": false,
            "conditionPolicy": "run-conditions-v2",
            "protocolVersion": "cpu-reference-v3",
            "configurationId": "cpu-reference-v2",
            "configurationSha256": "dde59e8b4b2e98ea5cf45ac4e6f67efc8907c6a6c9745293effa4f88e08f6b7a",
            "timingMethod": "engine-timings",
            "dispersion": {
              "ppTps": {
                "iqr": 4.9,
                "min": 190.5,
                "max": 200.3
              },
              "tgTps": {
                "iqr": 0.7,
                "min": 30.1,
                "max": 31.5
              }
            },
            "evidence": {
              "sessionIds": [
                "1767225600000-3-tablet"
              ],
              "bundleSha256": "bb5dbeccbb9bb5b1305f6a6c84813ee043fcfdb530f9d1a889591ea7ba0719c6",
              "url": "https://raw.githubusercontent.com/a-ghorbani/xebench/main/evidence/bb5dbeccbb9bb5b1305f6a6c84813ee043fcfdb530f9d1a889591ea7ba0719c6/manifest.json"
            },
            "build": {
              "engineVersion": "llama.cpp b11385 (bf9a0cc)",
              "bindingVersion": "llama.rn 0.0.0-fixture",
              "harnessCommit": "0123456789abcdef0123456789abcdef01234567",
              "runtimes": [
                {
                  "name": "llama.cpp",
                  "version": "b11385"
                },
                {
                  "name": "llama.rn",
                  "version": "0.0.0-fixture"
                }
              ]
            }
          }
        }
      ],
      "replacedRows": []
    },
    {
      "key": "llama.cpp|cpu|android|Google Pixel 9|Llama 3.2 1B|Q4_K_M|measured",
      "displayed": "1767225600000-0-pixel",
      "rule": "newest-verified",
      "sessions": [
        {
          "sessionId": "1767225600000-0-pixel",
          "timestampIso": "2026-03-01T00:00:00.000Z",
          "bundleSha256": "bb5dbeccbb9bb5b1305f6a6c84813ee043fcfdb530f9d1a889591ea7ba0719c6",
          "url": "https://raw.githubusercontent.com/a-ghorbani/xebench/main/evidence/bb5dbeccbb9bb5b1305f6a6c84813ee043fcfdb530f9d1a889591ea7ba0719c6/manifest.json",
          "validation": "verified",
          "guardsPassed": true,
          "row": {
            "engine": "llama.cpp",
            "backend": "cpu",
            "platform": "android",
            "device": "Google Pixel 9",
            "soc": "Tensor G4",
            "model": "Llama 3.2 1B",
            "quant": "Q4_K_M",
            "ppTps": 202.6,
            "tgTps": 30.4,
            "ttftMs": 25.9,
            "provenance": "measured",
            "sourceName": "PocketPal R&D lab (xebench)",
            "sourceUrl": "https://github.com/a-ghorbani/xebench/blob/main/METHODOLOGY.md",
            "sourceDate": "2026-03",
            "sampleCount": 4,
            "asStated": "n=4 cold-run median; prompt std-pp512-v1; decode 128 tok; publication-policy-v1 verified",
            "validation": "verified",
            "guardsPassed": true,
            "conditionPolicy": "run-conditions-v2",
            "protocolVersion": "cpu-reference-v3",
            "configurationId": "cpu-reference-v2",
            "configurationSha256": "82750e8dfefd30352d0aa3df19d6e1b8a3e4c44b4bc45297a2edd3ba959c639e",
            "timingMethod": "engine-timings",
            "dispersion": {
              "ppTps": {
                "iqr": 8.6,
                "min": 190.5,
                "max": 210.8
              },
              "tgTps": {
                "iqr": 1,
                "min": 29.3,
                "max": 31.5
              }
            },
            "evidence": {
              "sessionIds": [
                "1767225600000-0-pixel"
              ],
              "bundleSha256": "bb5dbeccbb9bb5b1305f6a6c84813ee043fcfdb530f9d1a889591ea7ba0719c6",
              "url": "https://raw.githubusercontent.com/a-ghorbani/xebench/main/evidence/bb5dbeccbb9bb5b1305f6a6c84813ee043fcfdb530f9d1a889591ea7ba0719c6/manifest.json"
            },
            "build": {
              "engineVersion": "llama.cpp b11385 (bf9a0cc)",
              "bindingVersion": "llama.rn 0.0.0-fixture",
              "harnessCommit": "0123456789abcdef0123456789abcdef01234567",
              "runtimes": [
                {
                  "name": "llama.cpp",
                  "version": "b11385"
                },
                {
                  "name": "llama.rn",
                  "version": "0.0.0-fixture"
                }
              ]
            }
          }
        },
        {
          "sessionId": "1767225600000-1-pixel",
          "timestampIso": "2026-03-02T00:00:00.000Z",
          "bundleSha256": "bb5dbeccbb9bb5b1305f6a6c84813ee043fcfdb530f9d1a889591ea7ba0719c6",
          "url": "https://raw.githubusercontent.com/a-ghorbani/xebench/main/evidence/bb5dbeccbb9bb5b1305f6a6c84813ee043fcfdb530f9d1a889591ea7ba0719c6/manifest.json",
          "validation": "failed",
          "guardsPassed": false,
          "row": {
            "engine": "llama.cpp",
            "backend": "cpu",
            "platform": "android",
            "device": "Google Pixel 9",
            "soc": "Tensor G4",
            "model": "Llama 3.2 1B",
            "quant": "Q4_K_M",
            "ppTps": 195.4,
            "tgTps": 30.8,
            "ttftMs": 26.3,